{
  "run_id": "run_fixture_text_stats",
  "plugin_id": "dev.leon.text-stats",
  "plugin_version": "1.0.0",
  "package_digest": "sha256:0000000000000000000000000000000000000000000000000000000000000000",
  "tool_name": "text_stats",
  "started_at": "2026-06-01T00:00:00Z",
  "finished_at": "2026-06-01T00:00:01Z",
  "status": "ok",
  "entitlement_id": null,
  "input_digest": "sha256:1111111111111111111111111111111111111111111111111111111111111111",
  "output_digest": "sha256:2222222222222222222222222222222222222222222222222222222222222222",
  "evidence_artifact_id": "artifact_text_stats_smoke",
  "policy_decision": "allowed",
  "sandbox_exit_status": 0
}
